{
  "$schema": "https://json-schema.org/draft/2020-12/schema",
  "$id": "https://pi-coding-agent.local/schemas/permissions.schema.json",
  "title": "PI Permission Configuration",
  "type": "object",
  "additionalProperties": false,
  "properties": {
    "$schema": {
      "type": "string"
    },
    "defaultPolicy": {
      "type": "object",
      "additionalProperties": false,
      "properties": {
        "tools": {
          "$ref": "#/$defs/permissionState"
        },
        "bash": {
          "$ref": "#/$defs/permissionState"
        },
        "mcp": {
          "$ref": "#/$defs/permissionState"
        },
        "skills": {
          "$ref": "#/$defs/permissionState"
        },
        "special": {
          "$ref": "#/$defs/permissionState"
        }
      }
    },
    "tools": {
      "description": "Pattern-based permissions for registered tools. Use exact names or `*` wildcards for canonical Pi built-ins and any extension-provided or third-party tools. Path-bearing built-ins also accept resource-qualified keys such as `read:/home/alice/project/generated/*` or `edit:c:/Users/alice/project/generated/*`.",
      "$ref": "#/$defs/permissionMap"
    },
    "bash": {
      "description": "Bash rules as word-prefix lists matched against the normalized argv of every command a bash invocation actually executes (including inside $(...), backticks, bash -c strings, and unwrapped wrappers like timeout/env/xargs). \"git diff\" covers `git diff --stat HEAD~3`; \"rg\" covers any rg invocation. Read-only commands are allowed by default via the built-in safe-command registry; precedence per command is deny > protected paths > ask > allow/registry > defaultPolicy.bash.",
      "type": "object",
      "additionalProperties": false,
      "properties": {
        "allow": {
          "$ref": "#/$defs/bashRuleList",
          "description": "Prefix rules that allow matching commands (subject to protected paths, write policy, and the unsafe-argument guard)."
        },
        "ask": {
          "$ref": "#/$defs/bashRuleList",
          "description": "Prefix rules that force a prompt even when the registry vouches for the command."
        },
        "deny": {
          "$ref": "#/$defs/bashRuleList",
          "description": "Prefix rules that deny matching commands outright."
        },
        "syntax": {
          "type": "object",
          "additionalProperties": false,
          "properties": {
            "subshells": {
              "$ref": "#/$defs/permissionState",
              "description": "Governs every construct the analyzer refuses by default: subshells `(...)`, brace groups `{ ...; }`, function declarations, and coprocesses. Default: deny."
            },
            "unanalyzable": {
              "$ref": "#/$defs/permissionState",
              "description": "Parse failures and constructs the analyzer cannot resolve (fails closed). Default: ask."
            }
          }
        },
        "registryOverrides": {
          "description": "Safe-command registry adjustments keyed by executable. `null` disables a built-in row; an object replaces or adds one.",
          "type": "object",
          "additionalProperties": {
            "oneOf": [
              {
                "type": "null"
              },
              {
                "type": "object",
                "additionalProperties": false,
                "properties": {
                  "safeSubcommands": {
                    "type": "array",
                    "items": {
                      "type": "string"
                    }
                  },
                  "unsafeArgs": {
                    "type": "array",
                    "items": {
                      "type": "string"
                    }
                  },
                  "unsafePatterns": {
                    "type": "array",
                    "items": {
                      "type": "string"
                    }
                  }
                }
              }
            ]
          }
        }
      }
    },
    "protectedPaths": {
      "description": "Additional protected path patterns for file tools and shell arguments/redirections, matched whole or per path segment. Matches deny unless YOLO and yoloBypassProtectedPaths are both enabled. Extends built-ins like .env, .ssh, id_rsa*, *.pem.",
      "type": "array",
      "items": {
        "type": "string",
        "minLength": 1
      }
    },
    "mcp": {
      "description": "Pattern-based permissions for targets invoked through a registered `mcp` tool when available.",
      "$ref": "#/$defs/permissionMap"
    },
    "skills": {
      "$ref": "#/$defs/permissionMap"
    },
    "special": {
      "description": "Reserved permission checks. The coarse `external_directory` key remains supported, and resource-qualified keys like `external_directory:/home/alice/shared/*` or `external_directory:c:/Users/alice/shared/*` can scope outside-worktree file access by normalized directory resource.",
      "type": "object",
      "additionalProperties": false,
      "properties": {
        "doom_loop": {
          "$ref": "#/$defs/permissionState"
        },
        "external_directory": {
          "description": "Coarse fallback for path-bearing file tools when they target paths outside the active working directory.",
          "$ref": "#/$defs/permissionState"
        }
      },
      "patternProperties": {
        "^external_directory:.+$": {
          "description": "Resource-qualified external directory rule. Use `external_directory:<normalized-absolute-directory>/*` to allow, deny, or ask for a specific outside directory.",
          "$ref": "#/$defs/permissionState"
        }
      }
    },
    "enabled": {
      "type": "boolean",
      "default": true,
      "description": "Enable the permission extension. Changes take effect when the extension loads."
    },
    "debug": {
      "type": "boolean",
      "default": false,
      "description": "Write permission diagnostics to the debug log."
    },
    "yoloMode": {
      "type": "boolean",
      "default": false,
      "description": "Startup YOLO default. Runtime toggles stay within the session; the parent auto-approves forwarded ask requests while enabled."
    },
    "desktopNotifications": {
      "type": "boolean",
      "default": true,
      "description": "Send a desktop notification when a prompt is waiting and the terminal is not focused."
    },
    "forwardedPromptTimeoutSeconds": {
      "oneOf": [
        {
          "type": "number",
          "exclusiveMinimum": 0
        },
        {
          "type": "null"
        },
        {
          "const": false
        }
      ],
      "default": 600,
      "description": "Seconds a forwarded request can wait, including time before it is displayed. Defaults to 600 (10 minutes); use null to wait indefinitely."
    },
    "yoloBypassProtectedPaths": {
      "type": "boolean",
      "default": false,
      "description": "When YOLO is on, bypass protected-path checks for file and shell tools. Explicit policy denies still apply."
    },
    "permissionMode": {
      "type": "string",
      "enum": ["ask", "auto", "yolo"],
      "default": "ask",
      "description": "Startup permission mode. Runtime mode changes are session-local. Legacy yoloMode:true takes precedence."
    },
    "autoReviewer": {
      "type": "string",
      "enum": ["luna", "jev"],
      "default": "luna",
      "description": "Auto reviewer. Luna uses the main model's Codex authentication when applicable, otherwise OPENAI_API_KEY. Jev uses TYPESAFE_API_KEY. Denials and failures ask the user."
    }
  },
  "$defs": {
    "permissionState": {
      "type": "string",
      "enum": ["allow", "deny", "ask"]
    },
    "permissionMap": {
      "type": "object",
      "propertyNames": {
        "type": "string",
        "minLength": 1
      },
      "additionalProperties": {
        "$ref": "#/$defs/permissionState"
      }
    },
    "bashRuleList": {
      "type": "array",
      "items": {
        "type": "string",
        "minLength": 1
      }
    }
  }
}
